"Sibley County, Minnesota, US",14865
"Stearns County, Minnesota, US",161075
"Steele County, Minnesota, US",36649
"Stevens County, Minnesota, US",9805
"Swift County, Minnesota, US",9266
"Todd County, Minnesota, US",24664
"Traverse County, Minnesota, US",3259
"Wabasha County, Minnesota, US",21627
"Wadena County, Minnesota, US",13682
"Waseca County, Minnesota, US",18612
"Washington County, Minnesota, US",262440
"Watonwan County, Minnesota, US",10897
"Wilkin County, Minnesota, US",6207
"Winona County, Minnesota, US",50484
"Wright County, Minnesota, US",138377
"Yellow Medicine County, Minnesota, US",9709
"Adams County, Mississippi, US",30693
"Alcorn County, Mississippi, US",36953
"Amite County, Mississippi, US",12297
"Attala County, Mississippi, US",18174
"Benton County, Mississippi, US",8259
"Bolivar County, Mississippi, US",30628
"Calhoun County, Mississippi, US",14361
"Carroll County, Mississippi, US",9947
"Chickasaw County, Mississippi, US",17103
"Choctaw County, Mississippi, US",8210
"Claiborne County, Mississippi, US",8988
"Clarke County, Mississippi, US",15541
"Clay County, Mississippi, US",19316
"Coahoma County, Mississippi, US",22124
"Copiah County, Mississippi, US",28065
"Covington County, Mississippi, US",18636
"DeSoto County, Mississippi, US",184945
"Forrest County, Mississippi, US",74897
"Franklin County, Mississippi, US",7713
"George County, Mississippi, US",24500
"Greene County, Mississippi, US",13586
"Grenada County, Mississippi, US",20758
"Hancock County, Mississippi, US",47632
"Harrison County, Mississippi, US",208080
"Hinds County, Mississippi, US",231840
"Holmes County, Mississippi, US",17010
"Humphreys County, Mississippi, US",8064
"Issaquena County, Mississippi, US",1327
"Itawamba County, Mississippi, US",23390
"Jackson County, Mississippi, US",143617
"Jasper County, Mississippi, US",16383
"Jefferson County, Mississippi, US",6990
"Jefferson Davis County, Mississippi, US",11128
"Jones County, Mississippi, US",68098
"Kemper County, Mississippi, US",9742
"Lafayette County, Mississippi, US",54019
"Lamar County, Mississippi, US",63343
"Lauderdale County, Mississippi, US",74125
"Lawrence County, Mississippi, US",12586
"Leake County, Mississippi, US",22786
"Lee County, Mississippi, US",85436
"Leflore County, Mississippi, US",28183
"Lincoln County, Mississippi, US",34153
"Lowndes County, Mississippi, US",58595
"Madison County, Mississippi, US",106272
"Marion County, Mississippi, US",24573
"Marshall County, Mississippi, US",35294
"Monroe County, Mississippi, US",35252
"Montgomery County, Mississippi, US",9775
"Neshoba County, Mississippi, US",29118
"Newton County, Mississippi, US",21018
"Noxubee County, Mississippi, US",10417
"Oktibbeha County, Mississippi, US",49587
"Panola County, Mississippi, US",34192
"Pearl River County, Mississippi, US",55535
"Perry County, Mississippi, US",11973
"Pike County, Mississippi, US",39288
"Pontotoc County, Mississippi, US",32174
"Prentiss County, Mississippi, US",25126
"Quitman County, Mississippi, US",6792
"Rankin County, Mississippi, US",155271
"Scott County, Mississippi, US",28124
"Sharkey County, Mississippi, US",4321
"Simpson County, Mississippi, US",26658
"Smith County, Mississippi, US",15916
"Stone County, Mississippi, US",18336
"Sunflower County, Mississippi, US",25110
"Tallahatchie County, Mississippi, US",13809
"Tate County, Mississippi, US",28321
"Tippah County, Mississippi, US",22015
"Tishomingo County, Mississippi, US",19383
"Tunica County, Mississippi, US",9632
"Union County, Mississippi, US",28815
"Walthall County, Mississippi, US",14286
"Warren County, Mississippi, US",45381
"Washington County, Mississippi, US",43909
"Wayne County, Mississippi, US",20183
"Webster County, Mississippi, US",9689
"Wilkinson County, Mississippi, US",8630
"Winston County, Mississippi, US",17955
"Yalobusha County, Mississippi, US",12108
"Yazoo County, Mississippi, US",29690
"Adair County, Missouri, US",25343
"Andrew County, Missouri, US",17712
"Atchison County, Missouri, US",5143
"Audrain County, Missouri, US",25388
"Barry County, Missouri, US",35789
"Barton County, Missouri, US",11754
"Bates County, Missouri, US",16172
"Benton County, Missouri, US",19443
"Bollinger County, Missouri, US",12133
"Boone County, Missouri, US",180463
"Buchanan County, Missouri, US",87364
"Butler County, Missouri, US",42478
"Caldwell County, Missouri, US",9020
"Callaway County, Missouri, US",44743
"Camden County, Missouri, US",46305
"Cape Girardeau County, Missouri, US",78871
"Carroll County, Missouri, US",8679
"Carter County, Missouri, US",5982
"Cass County, Missouri, US",105780
"Cedar County, Missouri, US",14349
"Chariton County, Missouri, US",7426
"Christian County, Missouri, US",88595
"Clark County, Missouri, US",6797
"Clay County, Missouri, US",249948
"Clinton County, Missouri, US",20387
"Cole County, Missouri, US",76745
"Cooper County, Missouri, US",17709
"Crawford County, Missouri, US",23920
"Dade County, Missouri, US",7561
"Dallas County, Missouri, US",16878
"Daviess County, Missouri, US",8278
"DeKalb County, Missouri, US",12547
"Dent County, Missouri, US",15573
"Douglas County, Missouri, US",13185
"Dunklin County, Missouri, US",29131
"Franklin County, Missouri, US",103967
"Gasconade County, Missouri, US",14706
"Gentry County, Missouri, US",6571
"Greene County, Missouri, US",293086
"Grundy County, Missouri, US",9850
"Harrison County, Missouri, US",8352
"Henry County, Missouri, US",21824
"Hickory County, Missouri, US",9544
"Holt County, Missouri, US",4403
"Howard County, Missouri, US",10001
"Howell County, Missouri, US",40117
"Iron County, Missouri, US",10125
"Jackson County, Missouri, US",703011
"Jasper County, Missouri, US",121328
"Jefferson County, Missouri, US",225081
"Johnson County, Missouri, US",54062
"Knox County, Missouri, US",3959
"Laclede County, Missouri, US",35723
"Lafayette County, Missouri, US",32708
"Lawrence County, Missouri, US",38355
"Lewis County, Missouri, US",9776
"Lincoln County, Missouri, US",59013
"Linn County, Missouri, US",11920
"Livingston County, Missouri, US",15227
"McDonald County, Missouri, US",22837
"Macon County, Missouri, US",15117
"Madison County, Missouri, US",12088
"Maries County, Missouri, US",8697
"Marion County, Missouri, US",28530
"Mercer County, Missouri, US",3617
"Miller County, Missouri, US",25619
"Mississippi County, Missouri, US",13180
"Moniteau County, Missouri, US",16132
"Monroe County, Missouri, US",8644
"Montgomery County, Missouri, US",11551
"Morgan County, Missouri, US",20627
"New Madrid County, Missouri, US",17076
"Newton County, Missouri, US",58236
"Nodaway County, Missouri, US",22092
"Oregon County, Missouri, US",10529
"Osage County, Missouri, US",13615
"Ozark County, Missouri, US",9174
"Pemiscot County, Missouri, US",15805
"Perry County, Missouri, US",19136
"Pettis County, Missouri, US",42339
"Phelps County, Missouri, US",44573
"Pike County, Missouri, US",18302
"Platte County, Missouri, US",104418
"Polk County, Missouri, US",32149
"Pulaski County, Missouri, US",52607
"Putnam County, Missouri, US",4696
"Ralls County, Missouri, US",10309
"Randolph County, Missouri, US",24748
"Ray County, Missouri, US",23018
"Reynolds County, Missouri, US",6270
"Ripley County, Missouri, US",13288
"St. Charles County, Missouri, US",402022
"St. Clair County, Missouri, US",9397
"Ste. Genevieve County, Missouri, US",17894
"St. Francois County, Missouri, US",67215
"St. Louis County, Missouri, US",994205
"Saline County, Missouri, US",22761
"Schuyler County, Missouri, US",4660
"Scotland County, Missouri, US",4902
"Scott County, Missouri, US",38280
"Shannon County, Missouri, US",8166
"Shelby County, Missouri, US",5930
"Stoddard County, Missouri, US",29025
"Stone County, Missouri, US",31952
"Sullivan County, Missouri, US",6089
"Taney County, Missouri, US",55928
"Texas County, Missouri, US",25398
"Vernon County, Missouri, US",20563
"Warren County, Missouri, US",35649
"Washington County, Missouri, US",24730
"Wayne County, Missouri, US",12873
"Webster County, Missouri, US",39592
"Worth County, Missouri, US",2013
"Wright County, Missouri, US",18289
"St. Louis city, Missouri, US",300576
"Beaverhead County, Montana, US",9453
"Big Horn County, Montana, US",13319
"Blaine County, Montana, US",6681
"Broadwater County, Montana, US",6237
"Carbon County, Montana, US",10725
"Carter County, Montana, US",1252
"Cascade County, Montana, US",81366
"Chouteau County, Montana, US",5635
"Custer County, Montana, US",11402
"Daniels County, Montana, US",1690
"Dawson County, Montana, US",8613
"Deer Lodge County, Montana, US",9140
"Fallon County, Montana, US",2846
"Fergus County, Montana, US",11050
"Flathead County, Montana, US",103806
"Gallatin County, Montana, US",114434
"Garfield County, Montana, US",1258
"Glacier County, Montana, US",13753
"Golden Valley County, Montana, US",821
"Granite County, Montana, US",3379
"Hill County, Montana, US",16484
"Jefferson County, Montana, US",12221
"Judith Basin County, Montana, US",2007
"Lake County, Montana, US",30458
"Lewis and Clark County, Montana, US",69432
"Liberty County, Montana, US",2337
"Lincoln County, Montana, US",19980
"McCone County, Montana, US",1664
"Madison County, Montana, US",8600
"Meagher County, Montana, US",1862
"Mineral County, Montana, US",4397
"Missoula County, Montana, US",119600
"Musselshell County, Montana, US",4633
"Park County, Montana, US",16606
"Petroleum County, Montana, US",487
"Phillips County, Montana, US",3954
"Pondera County, Montana, US",5911
"Powder River County, Montana, US",1682
"Powell County, Montana, US",6890
"Prairie County, Montana, US",1077
"Ravalli County, Montana, US",43806
"Richland County, Montana, US",10803
"Roosevelt County, Montana, US",11004
"Rosebud County, Montana, US",8937
"Sanders County, Montana, US",12113
"Sheridan County, Montana, US",3309
"Silver Bow County, Montana, US",34915
"Stillwater County, Montana, US",9642
"Sweet Grass County, Montana, US",3737
"Teton County, Montana, US",6147
"Toole County, Montana, US",4736
"Treasure County, Montana, US",696
"Valley County, Montana, US",7396
"Wheatland County, Montana, US",2126
"Wibaux County, Montana, US",969
"Yellowstone County, Montana, US",161300
"Adams County, Nebraska, US",31363
"Antelope County, Nebraska, US",6298
"Arthur County, Nebraska, US",463
"Banner County, Nebraska, US",745
"Blaine County, Nebraska, US",465
"Boone County, Nebraska, US",5192
"Box Butte County, Nebraska, US",10783
"Boyd County, Nebraska, US",1919
"Brown County, Nebraska, US",2955
"Buffalo County, Nebraska, US",49659
"Burt County, Nebraska, US",6459
"Butler County, Nebraska, US",8016
"Cass County, Nebraska, US",26248
"Cedar County, Nebraska, US",8402
"Chase County, Nebraska, US",3924
"Cherry County, Nebraska, US",5689
"Cheyenne County, Nebraska, US",8910
"Clay County, Nebraska, US",6203
"Colfax County, Nebraska, US",10709
"Cuming County, Nebraska, US",8846
"Custer County, Nebraska, US",10777
"Dakota County, Nebraska, US",20026
"Dawes County, Nebraska, US",8589
"Dawson County, Nebraska, US",23595
"Deuel County, Nebraska, US",1794
"Dixon County, Nebraska, US",5636
"Dodge County, Nebraska, US",36565
"Douglas County, Nebraska, US",571327
"Dundy County, Nebraska, US",1693
"Fillmore County, Nebraska, US",5462
"Franklin County, Nebraska, US",2979
"Frontier County, Nebraska, US",2627
"Furnas County, Nebraska, US",4676
"Gage County, Nebraska, US",21513
"Garden County, Nebraska, US",1837
"Garfield County, Nebraska, US",1969
"Gosper County, Nebraska, US",1990
"Grant County, Nebraska, US",623
"Greeley County, Nebraska, US",2356
"Hall County, Nebraska, US",61353
"Hamilton County, Nebraska, US",9324
"Harlan County, Nebraska, US",3380
"Hayes County, Nebraska, US",922
"Hitchcock County, Nebraska, US",2762
"Holt County, Nebraska, US",10067
"Hooker County, Nebraska, US",682
"Howard County, Nebraska, US",6445
"Jefferson County, Nebraska, US",7046
"Johnson County, Nebraska, US",5071
"Kearney County, Nebraska, US",6495
"Keith County, Nebraska, US",8034
"Keya Paha County, Nebraska, US",806
"Kimball County, Nebraska, US",3632
"Knox County, Nebraska, US",8332
"Lancaster County, Nebraska, US",319090
"Lincoln County, Nebraska, US",34914
"Logan County, Nebraska, US",748
"Loup County, Nebraska, US",664
"McPherson County, Nebraska, US",494
"Madison County, Nebraska, US",35099
"Merrick County, Nebraska, US",7755
"Morrill County, Nebraska, US",4642
"Nance County, Nebraska, US",3519
"Nemaha County, Nebraska, US",6972
"Nuckolls County, Nebraska, US",4148
"Otoe County, Nebraska, US",16012
"Pawnee County, Nebraska, US",2613
"Perkins County, Nebraska, US",2891
"Phelps County, Nebraska, US",9034
"Pierce County, Nebraska, US",7148
"Platte County, Nebraska, US",33470
"Polk County, Nebraska, US",5213
"Red Willow County, Nebraska, US",10724
"Richardson County, Nebraska, US",7865
"Rock County, Nebraska, US",1357
"Saline County, Nebraska, US",14224
"Sarpy County, Nebraska, US",187196
"Saunders County, Nebraska, US",21578
"Scotts Bluff County, Nebraska, US",35618
"Seward County, Nebraska, US",17284
"Sheridan County, Nebraska, US",5246
"Sherman County, Nebraska, US",3001
"Sioux County, Nebraska, US",1166
"Stanton County, Nebraska, US",5920
"Thayer County, Nebraska, US",5003
"Thomas County, Nebraska, US",722
"Thurston County, Nebraska, US",7224
"Valley County, Nebraska, US",4158
"Washington County, Nebraska, US",20729
"Wayne County, Nebraska, US",9385
"Webster County, Nebraska, US",3487
"Wheeler County, Nebraska, US",783
"York County, Nebraska, US",13679
"Churchill County, Nevada, US",24909
"Clark County, Nevada, US",2266715
"Douglas County, Nevada, US",48905
"Elko County, Nevada, US",52778
"Esmeralda County, Nevada, US",873
"Eureka County, Nevada, US",2029
"Humboldt County, Nevada, US",16831
"Lander County, Nevada, US",5532
"Lincoln County, Nevada, US",5183
"Lyon County, Nevada, US",57510
"Mineral County, Nevada, US",4505
"Nye County, Nevada, US",46523
"Pershing County, Nevada, US",6725
"Storey County, Nevada, US",4123
"Washoe County, Nevada, US",471519
"White Pine County, Nevada, US",9580
"Carson City, Nevada, US",55916
"Belknap County, New Hampshire, US",61303
"Carroll County, New Hampshire, US",48910
"Cheshire County, New Hampshire, US",76085
"Coos County, New Hampshire, US",31563
"Grafton County, New Hampshire, US",89886
"Hillsborough County, New Hampshire, US",417025
"Merrimack County, New Hampshire, US",151391
"Rockingham County, New Hampshire, US",309769
"Strafford County, New Hampshire, US",130633
"Sullivan County, New Hampshire, US",43146
"Atlantic County, New Jersey, US",263670
"Bergen County, New Jersey, US",932202
"Burlington County, New Jersey, US",445349
"Camden County, New Jersey, US",506471
"Cape May County, New Jersey, US",92039
"Cumberland County, New Jersey, US",149527
"Essex County, New Jersey, US",798975
"Gloucester County, New Jersey, US",291636
"Hudson County, New Jersey, US",672391
"Hunterdon County, New Jersey, US",124371
"Mercer County, New Jersey, US",367430
"Middlesex County, New Jersey, US",825062
"Monmouth County, New Jersey, US",618795
"Morris County, New Jersey, US",491845
"Ocean County, New Jersey, US",607186
"Passaic County, New Jersey, US",501826
"Salem County, New Jersey, US",62385
"Somerset County, New Jersey, US",328934
"Sussex County, New Jersey, US",140488
"Union County, New Jersey, US",556341
"Warren County, New Jersey, US",105267
"Bernalillo County, New Mexico, US",679121
"Catron County, New Mexico, US",3527
"Chaves County, New Mexico, US",64615
"Cibola County, New Mexico, US",26675
"Colfax County, New Mexico, US",11941
"Curry County, New Mexico, US",48954
"De Baca County, New Mexico, US",1748
"Doña Ana County, New Mexico, US",218195
"Eddy County, New Mexico, US",58460
"Grant County, New Mexico, US",26998
"Guadalupe County, New Mexico, US",4300
"Harding County, New Mexico, US",625
"Hidalgo County, New Mexico, US",4198
"Lea County, New Mexico, US",71070
"Lincoln County, New Mexico, US",19572
"Los Alamos County, New Mexico, US",19369
"Luna County, New Mexico, US",23709
"McKinley County, New Mexico, US",71367
"Mora County, New Mexico, US",4521
"Otero County, New Mexico, US",67490
"Quay County, New Mexico, US",8253
"Rio Arriba County, New Mexico, US",38921
"Roosevelt County, New Mexico, US",18500
"Sandoval County, New Mexico, US",146748
"San Juan County, New Mexico, US",123958
"San Miguel County, New Mexico, US",27277
"Santa Fe County, New Mexico, US",150358
"Sierra County, New Mexico, US",10791
"Socorro County, New Mexico, US",16637
"Taos County, New Mexico, US",32723
"Torrance County, New Mexico, US",15461
"Union County, New Mexico, US",4059
"Valencia County, New Mexico, US",76688
"Albany County, New York, US",305506
"Allegany County, New York, US",46091
"Bronx County, New York, US",1418207
"Broome County, New York, US",190488
"Cattaraugus County, New York, US",76117
"Cayuga County, New York, US",76576
"Chautauqua County, New York, US",126903
"Chemung County, New York, US",83456
"Chenango County, New York, US",47207
"Clinton County, New York, US",80485
"Columbia County, New York, US",59461
"Cortland County, New York, US",47581
"Delaware County, New York, US",44135
"Dutchess County, New York, US",294218
"Erie County, New York, US",918702
"Essex County, New York, US",36885
"Franklin County, New York, US",50022
"Fulton County, New York, US",53383
"Genesee County, New York, US",57280
"Greene County, New York, US",47188
"Hamilton County, New York, US",4416
"Herkimer County, New York, US",61319
"Jefferson County, New York, US",109834
"Kings County, New York, US",2559903
"Lewis County, New York, US",26296
"Livingston County, New York, US",62914
"Madison County, New York, US",70941
"Monroe County, New York, US",741770
"Montgomery County, New York, US",49221
"Nassau County, New York, US",1356924
"New York County, New York, US",1628706
"Niagara County, New York, US",209281
"Oneida County, New York, US",228671
"Onondaga County, New York, US",460528
"Ontario County, New York, US",109777
"Orange County, New York, US",384940
"Orleans County, New York, US",40352
"Oswego County, New York, US",117124
"Otsego County, New York, US",59493
"Putnam County, New York, US",98320
"Queens County, New York, US",2253858
"Rensselaer County, New York, US",158714
"Richmond County, New York, US",476143
"Rockland County, New York, US",325789
"St. Lawrence County, New York, US",107740
"Saratoga County, New York, US",229863
"Schenectady County, New York, US",155299
"Schoharie County, New York, US",30999
"Schuyler County, New York, US",17807
"Seneca County, New York, US",34016
"Steuben County, New York, US",95379
"Suffolk County, New York, US",1476601
"Sullivan County, New York, US",75432
"Tioga County, New York, US",48203
"Tompkins County, New York, US",102180
"Ulster County, New York, US",177573
"Warren County, New York, US",63944
"Washington County, New York, US",61204
"Wayne County, New York, US",89918
"Westchester County, New York, US",967506
"Wyoming County, New York, US",39859
"Yates County, New York, US",24913
"Alamance County, North Carolina, US",169509
"Alexander County, North Carolina, US",37497
"Alleghany County, North Carolina, US",11137
"Anson County, North Carolina, US",24446
"Ashe County, North Carolina, US",27203
"Avery County, North Carolina, US",17557
"Beaufort County, North Carolina, US",46994
"Bertie County, North Carolina, US",18947
"Bladen County, North Carolina, US",32722
"Brunswick County, North Carolina, US",142820
"Buncombe County, North Carolina, US",261191
"Burke County, North Carolina, US",90485
"Cabarrus County, North Carolina, US",216453
"Caldwell County, North Carolina, US",82178
"Camden County, North Carolina, US",10867
"Carteret County, North Carolina, US",69473
"Caswell County, North Carolina, US",22604
"Catawba County, North Carolina, US",159551
"Chatham County, North Carolina, US",74470
"Cherokee County, North Carolina, US",28612
"Chowan County, North Carolina, US",13943
"Clay County, North Carolina, US",11231
"Cleveland County, North Carolina, US",97947
"Columbus County, North Carolina, US",55508
"Craven County, North Carolina, US",102139
"Cumberland County, North Carolina, US",335509
"Currituck County, North Carolina, US",27763
"Dare County, North Carolina, US",37009
"Davidson County, North Carolina, US",167609
"Davie County, North Carolina, US",42846
"Duplin County, North Carolina, US",58741
"Durham County, North Carolina, US",321488
"Edgecombe County, North Carolina, US",51472
"Forsyth County, North Carolina, US",382295
"Franklin County, North Carolina, US",69685
"Gaston County, North Carolina, US",224529
"Gates County, North Carolina, US",11562
"Graham County, North Carolina, US",8441
"Granville County, North Carolina, US",60443
"Greene County, North Carolina, US",21069
"Guilford County, North Carolina, US",537174
"Halifax County, North Carolina, US",50010
"Harnett County, North Carolina, US",135976
"Haywood County, North Carolina, US",62317
"Henderson County, North Carolina, US",117417
"Hertford County, North Carolina, US",23677
"Hoke County, North Carolina, US",55234
"Hyde County, North Carolina, US",4937
"Iredell County, North Carolina, US",181806
"Jackson County, North Carolina, US",43938
"Johnston County, North Carolina, US",209339
"Jones County, North Carolina, US",9419
"Lee County, North Carolina, US",61779
"Lenoir County, North Carolina, US",55949
"Lincoln County, North Carolina, US",86111
"McDowell County, North Carolina, US",45756
"Macon County, North Carolina, US",35858
"Madison County, North Carolina, US",21755
"Martin County, North Carolina, US",22440
"Mecklenburg County, North Carolina, US",1110356
"Mitchell County, North Carolina, US",14964
"Montgomery County, North Carolina, US",27173
"Moore County, North Carolina, US",100880
"Nash County, North Carolina, US",94298
"New Hanover County, North Carolina, US",234473
"Northampton County, North Carolina, US",19483
"Onslow County, North Carolina, US",197938
"Orange County, North Carolina, US",148476
"Pamlico County, North Carolina, US",12726
"Pasquotank County, North Carolina, US",39824
"Pender County, North Carolina, US",63060
"Perquimans County, North Carolina, US",13463
"Person County, North Carolina, US",39490
"Pitt County, North Carolina, US",180742
"Polk County, North Carolina, US",20724
"Randolph County, North Carolina, US",143667
"Richmond County, North Carolina, US",44829
"Robeson County, North Carolina, US",130625
"Rockingham County, North Carolina, US",91010
"Rowan County, North Carolina, US",142088
"Rutherford County, North Carolina, US",67029
"Sampson County, North Carolina, US",63531
"Scotland County, North Carolina, US",34823
"Stanly County, North Carolina, US",62806
"Stokes County, North Carolina, US",45591
"Surry County, North Carolina, US",71783
"Swain County, North Carolina, US",14271
"Transylvania County, North Carolina, US",34385
"Tyrrell County, North Carolina, US",4016
"Union County, North Carolina, US",239859
"Vance County, North Carolina, US",44535
"Wake County, North Carolina, US",1111761
"Warren County, North Carolina, US",19731
"Washington County, North Carolina, US",11580
"Watauga County, North Carolina, US",56177
"Wayne County, North Carolina, US",123131
"Wilkes County, North Carolina, US",68412
"Wilson County, North Carolina, US",81801
"Yadkin County, North Carolina, US",37667
"Yancey County, North Carolina, US",18069
"Adams County, North Dakota, US",2216
"Barnes County, North Dakota, US",10415
"Benson County, North Dakota, US",6832
"Billings County, North Dakota, US",928
"ottineau County, North Dakota, US",6282
"Bowman County, North Dakota, US",3024
"Burke County, North Dakota, US",2115
"Burleigh County, North Dakota, US",95626
"Cass County, North Dakota, US",181923
"Cavalier County, North Dakota, US",3762
"Dickey County, North Dakota, US",4872
"Divide County, North Dakota, US",2264
"Dunn County, North Dakota, US",4424
"Eddy County, North Dakota, US",2287
"Emmons County, North Dakota, US",3241
"Foster County, North Dakota, US",3210
"Golden Valley County, North Dakota, US",1761
"Grand Forks County, North Dakota, US",69451
"Grant County, North Dakota, US",2274
"Griggs County, North Dakota, US",2231
"Hettinger County, North Dakota, US",2499
"Kidder County, North Dakota, US",2480
"LaMoure County, North Dakota, US",4046
"Logan County, North Dakota, US",1850
"McHenry County, North Dakota, US",5745
"McIntosh County, North Dakota, US",2497
"McKenzie County, North Dakota, US",15024
"McLean County, North Dakota, US",9450
"Mercer County, North Dakota, US",8187
"Morton County, North Dakota, US",31364
"Mountrail County, North Dakota, US",10545
"Nelson County, North Dakota, US",2879
"Oliver County, North Dakota, US",1959
"Pembina County, North Dakota, US",6801
"Pierce County, North Dakota, US",3975
"Ramsey County, North Dakota, US",11519
"Ransom County, North Dakota, US",5218
"Renville County, North Dakota, US",2327
"Richland County, North Dakota, US",16177
"Rolette County, North Dakota, US",14176
"Sargent County, North Dakota, US",3898
"Sheridan County, North Dakota, US",1315
"Sioux County, North Dakota, US",4230
"Slope County, North Dakota, US",750
"Stark County, North Dakota, US",31489
"Steele County, North Dakota, US",1890
"Stutsman County, North Dakota, US",20704
"Towner County, North Dakota, US",2189
"Traill County, North Dakota, US",8036
"Walsh County, North Dakota, US",10641
"Ward County, North Dakota, US",67641
"Wells County, North Dakota, US",3834
"Williams County, North Dakota, US",37589
"Adams County, Ohio, US",27698
