"Allen County, Ohio, US",102351
"Ashland County, Ohio, US",53484
"Ashtabula County, Ohio, US",97241
"Athens County, Ohio, US",65327
"Auglaize County, Ohio, US",45656
"Belmont County, Ohio, US",67006
"Brown County, Ohio, US",43432
"Butler County, Ohio, US",383134
"Carroll County, Ohio, US",26914
"Champaign County, Ohio, US",38885
"Clark County, Ohio, US",134083
"Clermont County, Ohio, US",206428
"Clinton County, Ohio, US",41968
"Columbiana County, Ohio, US",101883
"Coshocton County, Ohio, US",36600
"Crawford County, Ohio, US",41494
"Cuyahoga County, Ohio, US",1235072
"Darke County, Ohio, US",51113
"Defiance County, Ohio, US",38087
"Delaware County, Ohio, US",209177
"Erie County, Ohio, US",74266
"Fairfield County, Ohio, US",157574
"Fayette County, Ohio, US",28525
"Franklin County, Ohio, US",1316756
"Fulton County, Ohio, US",42126
"Gallia County, Ohio, US",29898
"Geauga County, Ohio, US",93649
"Greene County, Ohio, US",168937
"Guernsey County, Ohio, US",38875
"Hamilton County, Ohio, US",817473
"Hancock County, Ohio, US",75783
"Hardin County, Ohio, US",31365
"Harrison County, Ohio, US",15040
"Henry County, Ohio, US",27006
"Highland County, Ohio, US",43161
"Hocking County, Ohio, US",28264
"Holmes County, Ohio, US",43960
"Huron County, Ohio, US",58266
"Jackson County, Ohio, US",32413
"Jefferson County, Ohio, US",65325
"Knox County, Ohio, US",62322
"Lake County, Ohio, US",230149
"Lawrence County, Ohio, US",59463
"Licking County, Ohio, US",176862
"Logan County, Ohio, US",45672
"Lorain County, Ohio, US",309833
"Lucas County, Ohio, US",428348
"Madison County, Ohio, US",44731
"Mahoning County, Ohio, US",228683
"Marion County, Ohio, US",65093
"Medina County, Ohio, US",179746
"Meigs County, Ohio, US",22907
"Mercer County, Ohio, US",41172
"Miami County, Ohio, US",106987
"Monroe County, Ohio, US",13654
"Montgomery County, Ohio, US",531687
"Morgan County, Ohio, US",14508
"Morrow County, Ohio, US",35328
"Muskingum County, Ohio, US",86215
"Noble County, Ohio, US",14424
"Ottawa County, Ohio, US",40525
"Paulding County, Ohio, US",18672
"Perry County, Ohio, US",36134
"Pickaway County, Ohio, US",58457
"Pike County, Ohio, US",27772
"Portage County, Ohio, US",162466
"Preble County, Ohio, US",40882
"Putnam County, Ohio, US",33861
"Richland County, Ohio, US",121154
"Ross County, Ohio, US",76666
"Sandusky County, Ohio, US",58518
"Scioto County, Ohio, US",75314
"Seneca County, Ohio, US",55178
"Shelby County, Ohio, US",48590
"Stark County, Ohio, US",370606
"Summit County, Ohio, US",541013
"Trumbull County, Ohio, US",197974
"Tuscarawas County, Ohio, US",91987
"Union County, Ohio, US",58988
"Van Wert County, Ohio, US",28275
"Vinton County, Ohio, US",13085
"Warren County, Ohio, US",234602
"Washington County, Ohio, US",59911
"Wayne County, Ohio, US",115710
"Williams County, Ohio, US",36692
"Wood County, Ohio, US",130817
"Wyandot County, Ohio, US",21772
"Adair County, Oklahoma, US",22194
"Alfalfa County, Oklahoma, US",5702
"Atoka County, Oklahoma, US",13758
"Beaver County, Oklahoma, US",5311
"Beckham County, Oklahoma, US",21859
"Blaine County, Oklahoma, US",9429
"Bryan County, Oklahoma, US",47995
"Caddo County, Oklahoma, US",28762
"Canadian County, Oklahoma, US",148306
"Carter County, Oklahoma, US",48111
"Cherokee County, Oklahoma, US",48657
"Choctaw County, Oklahoma, US",14672
"Cimarron County, Oklahoma, US",2137
"Cleveland County, Oklahoma, US",284014
"Coal County, Oklahoma, US",5495
"Comanche County, Oklahoma, US",120749
"Cotton County, Oklahoma, US",5666
"Craig County, Oklahoma, US",14142
"Creek County, Oklahoma, US",71522
"Custer County, Oklahoma, US",29003
"Delaware County, Oklahoma, US",43009
"Dewey County, Oklahoma, US",4891
"Ellis County, Oklahoma, US",3859
"Garfield County, Oklahoma, US",61056
"Garvin County, Oklahoma, US",27711
"Grady County, Oklahoma, US",55834
"Grant County, Oklahoma, US",4333
"Greer County, Oklahoma, US",5712
"Harmon County, Oklahoma, US",2653
"Harper County, Oklahoma, US",3688
"Haskell County, Oklahoma, US",12627
"Hughes County, Oklahoma, US",13279
"Jackson County, Oklahoma, US",24530
"Jefferson County, Oklahoma, US",6002
"Johnston County, Oklahoma, US",11085
"Kay County, Oklahoma, US",43538
"Kingfisher County, Oklahoma, US",15765
"Kiowa County, Oklahoma, US",8708
"Latimer County, Oklahoma, US",10073
"Le Flore County, Oklahoma, US",49853
"Lincoln County, Oklahoma, US",34877
"Logan County, Oklahoma, US",48011
"Love County, Oklahoma, US",10253
"McClain County, Oklahoma, US",40474
"McCurtain County, Oklahoma, US",32832
"McIntosh County, Oklahoma, US",19596
"Major County, Oklahoma, US",7629
"Marshall County, Oklahoma, US",16931
"Mayes County, Oklahoma, US",41100
"Murray County, Oklahoma, US",14073
"Muskogee County, Oklahoma, US",67997
"Noble County, Oklahoma, US",11131
"Nowata County, Oklahoma, US",10076
"Okfuskee County, Oklahoma, US",11993
"Oklahoma County, Oklahoma, US",797434
"Okmulgee County, Oklahoma, US",38465
"Osage County, Oklahoma, US",46963
"Ottawa County, Oklahoma, US",31127
"Pawnee County, Oklahoma, US",16376
"Payne County, Oklahoma, US",81784
"Pittsburg County, Oklahoma, US",43654
"Pontotoc County, Oklahoma, US",38284
"Pottawatomie County, Oklahoma, US",72592
"Pushmataha County, Oklahoma, US",11096
"Roger Mills County, Oklahoma, US",3583
"Rogers County, Oklahoma, US",92459
"Seminole County, Oklahoma, US",24258
"Sequoyah County, Oklahoma, US",41569
"Stephens County, Oklahoma, US",43143
"Texas County, Oklahoma, US",19983
"Tillman County, Oklahoma, US",7250
"Tulsa County, Oklahoma, US",651552
"Wagoner County, Oklahoma, US",81289
"Washington County, Oklahoma, US",51527
"Washita County, Oklahoma, US",10916
"Woods County, Oklahoma, US",8793
"Woodward County, Oklahoma, US",20211
"Baker County, Oregon, US",16124
"Benton County, Oregon, US",93053
"Clackamas County, Oregon, US",418187
"Clatsop County, Oregon, US",40224
"Columbia County, Oregon, US",52354
"Coos County, Oregon, US",64487
"Crook County, Oregon, US",24404
"Curry County, Oregon, US",22925
"Deschutes County, Oregon, US",197692
"Douglas County, Oregon, US",110980
"Gilliam County, Oregon, US",1912
"Grant County, Oregon, US",7199
"Harney County, Oregon, US",7393
"Hood River County, Oregon, US",23382
"Jackson County, Oregon, US",220944
"Jefferson County, Oregon, US",24658
"Josephine County, Oregon, US",87487
"Klamath County, Oregon, US",68238
"Lake County, Oregon, US",7869
"Lane County, Oregon, US",382067
"Lincoln County, Oregon, US",49962
"Linn County, Oregon, US",129749
"Malheur County, Oregon, US",30571
"Marion County, Oregon, US",347818
"Morrow County, Oregon, US",11603
"Multnomah County, Oregon, US",812855
"Polk County, Oregon, US",86085
"Sherman County, Oregon, US",1780
"Tillamook County, Oregon, US",27036
"Umatilla County, Oregon, US",77950
"Union County, Oregon, US",26835
"Wallowa County, Oregon, US",7208
"Wasco County, Oregon, US",26682
"Washington County, Oregon, US",601592
"Wheeler County, Oregon, US",1332
"Yamhill County, Oregon, US",107100
"Adams County, Pennsylvania, US",103009
"Allegheny County, Pennsylvania, US",1216045
"Armstrong County, Pennsylvania, US",64735
"Beaver County, Pennsylvania, US",163929
"Bedford County, Pennsylvania, US",47888
"Berks County, Pennsylvania, US",421164
"Blair County, Pennsylvania, US",121829
"Bradford County, Pennsylvania, US",60323
"Bucks County, Pennsylvania, US",628270
"Butler County, Pennsylvania, US",187853
"Cambria County, Pennsylvania, US",130192
"Cameron County, Pennsylvania, US",4447
"Carbon County, Pennsylvania, US",64182
"Centre County, Pennsylvania, US",162385
"Chester County, Pennsylvania, US",524989
"Clarion County, Pennsylvania, US",38438
"Clearfield County, Pennsylvania, US",79255
"Clinton County, Pennsylvania, US",38632
"Columbia County, Pennsylvania, US",64964
"Crawford County, Pennsylvania, US",84629
"Cumberland County, Pennsylvania, US",253370
"Dauphin County, Pennsylvania, US",278299
"Delaware County, Pennsylvania, US",566747
"Elk County, Pennsylvania, US",29910
"Erie County, Pennsylvania, US",269728
"Fayette County, Pennsylvania, US",129274
"Forest County, Pennsylvania, US",7247
"Franklin County, Pennsylvania, US",155027
"Fulton County, Pennsylvania, US",14530
"Greene County, Pennsylvania, US",36233
"Huntingdon County, Pennsylvania, US",45144
"Indiana County, Pennsylvania, US",84073
"Jefferson County, Pennsylvania, US",43425
"Juniata County, Pennsylvania, US",24763
"Lackawanna County, Pennsylvania, US",209674
"Lancaster County, Pennsylvania, US",545724
"Lawrence County, Pennsylvania, US",85512
"Lebanon County, Pennsylvania, US",141793
"Lehigh County, Pennsylvania, US",369318
"Luzerne County, Pennsylvania, US",317417
"Lycoming County, Pennsylvania, US",113299
"McKean County, Pennsylvania, US",40625
"Mercer County, Pennsylvania, US",109424
"Mifflin County, Pennsylvania, US",46138
"Monroe County, Pennsylvania, US",170271
"Montgomery County, Pennsylvania, US",830915
"Montour County, Pennsylvania, US",18230
"Northampton County, Pennsylvania, US",305285
"Northumberland County, Pennsylvania, US",90843
"Perry County, Pennsylvania, US",46272
"Philadelphia County, Pennsylvania, US",1584064
"Pike County, Pennsylvania, US",55809
"Potter County, Pennsylvania, US",16526
"Schuylkill County, Pennsylvania, US",141359
"Snyder County, Pennsylvania, US",40372
"Somerset County, Pennsylvania, US",73447
"Sullivan County, Pennsylvania, US",6066
"Susquehanna County, Pennsylvania, US",40328
"Tioga County, Pennsylvania, US",40591
"Union County, Pennsylvania, US",44923
"Venango County, Pennsylvania, US",50668
"Warren County, Pennsylvania, US",39191
"Washington County, Pennsylvania, US",206865
"Wayne County, Pennsylvania, US",51361
"Westmoreland County, Pennsylvania, US",348899
"Wyoming County, Pennsylvania, US",26794
"York County, Pennsylvania, US",449058
"Bristol County, Rhode Island, US",48479
"Kent County, Rhode Island, US",164292
"Newport County, Rhode Island, US",82082
"Providence County, Rhode Island, US",638931
"Washington County, Rhode Island, US",125577
"Abbeville County, South Carolina, US",24527
"Aiken County, South Carolina, US",170872
"Allendale County, South Carolina, US",8688
"Anderson County, South Carolina, US",202558
"Bamberg County, South Carolina, US",14066
"Barnwell County, South Carolina, US",20866
"Beaufort County, South Carolina, US",192122
"Berkeley County, South Carolina, US",227907
"Calhoun County, South Carolina, US",14553
"Charleston County, South Carolina, US",411406
"Cherokee County, South Carolina, US",57300
"Chester County, South Carolina, US",32244
"Chesterfield County, South Carolina, US",45650
"Clarendon County, South Carolina, US",33745
"Colleton County, South Carolina, US",37677
"Darlington County, South Carolina, US",66618
"Dillon County, South Carolina, US",30479
"Dorchester County, South Carolina, US",162809
"Edgefield County, South Carolina, US",27260
"Fairfield County, South Carolina, US",22347
"Florence County, South Carolina, US",138293
"Georgetown County, South Carolina, US",62680
"Greenville County, South Carolina, US",523542
"Greenwood County, South Carolina, US",70811
"Hampton County, South Carolina, US",19222
"Horry County, South Carolina, US",354081
"Jasper County, South Carolina, US",30073
"Kershaw County, South Carolina, US",66551
"Lancaster County, South Carolina, US",98012
"Laurens County, South Carolina, US",67493
"Lee County, South Carolina, US",16828
"Lexington County, South Carolina, US",298750
"McCormick County, South Carolina, US",9463
"Marion County, South Carolina, US",30657
"Marlboro County, South Carolina, US",26118
"Newberry County, South Carolina, US",38440
"Oconee County, South Carolina, US",79546
"Orangeburg County, South Carolina, US",86175
"Pickens County, South Carolina, US",126884
"Richland County, South Carolina, US",415759
"Saluda County, South Carolina, US",20473
"Spartanburg County, South Carolina, US",319785
"Sumter County, South Carolina, US",106721
"Union County, South Carolina, US",27316
"Williamsburg County, South Carolina, US",30368
"York County, South Carolina, US",280979
"Aurora County, South Dakota, US",2751
"Beadle County, South Dakota, US",18453
"Bennett County, South Dakota, US",3365
"Bon Homme County, South Dakota, US",6901
"Brookings County, South Dakota, US",35077
"Brown County, South Dakota, US",38839
"Brule County, South Dakota, US",5297
"Buffalo County, South Dakota, US",1962
"Butte County, South Dakota, US",10429
"Campbell County, South Dakota, US",1376
"Charles Mix County, South Dakota, US",9292
"Clark County, South Dakota, US",3736
"Clay County, South Dakota, US",14070
"Codington County, South Dakota, US",28009
"Corson County, South Dakota, US",4086
"Custer County, South Dakota, US",8972
"Davison County, South Dakota, US",19775
"Day County, South Dakota, US",5424
"Deuel County, South Dakota, US",4351
"Dewey County, South Dakota, US",5892
"Douglas County, South Dakota, US",2921
"Edmunds County, South Dakota, US",3829
"Fall River County, South Dakota, US",6713
"Faulk County, South Dakota, US",2299
"Grant County, South Dakota, US",7052
"Gregory County, South Dakota, US",4185
"Haakon County, South Dakota, US",1899
"Hamlin County, South Dakota, US",6164
"Hand County, South Dakota, US",3191
"Hanson County, South Dakota, US",3453
"Harding County, South Dakota, US",1298
"Hughes County, South Dakota, US",17526
"Hutchinson County, South Dakota, US",7291
"Hyde County, South Dakota, US",1301
"Jackson County, South Dakota, US",3344
"Jerauld County, South Dakota, US",2013
"Jones County, South Dakota, US",903
"Kingsbury County, South Dakota, US",4939
"Lake County, South Dakota, US",12797
"Lawrence County, South Dakota, US",25844
"Lincoln County, South Dakota, US",61128
"Lyman County, South Dakota, US",3781
"McCook County, South Dakota, US",5586
"McPherson County, South Dakota, US",2379
"Marshall County, South Dakota, US",4935
"Meade County, South Dakota, US",28332
"Mellette County, South Dakota, US",2061
"Miner County, South Dakota, US",2216
"Minnehaha County, South Dakota, US",193134
"Moody County, South Dakota, US",6576
"Oglala Lakota County, South Dakota, US",14177
"Pennington County, South Dakota, US",113775
"Perkins County, South Dakota, US",2865
"Potter County, South Dakota, US",2153
"Roberts County, South Dakota, US",10394
"Sanborn County, South Dakota, US",2344
"Spink County, South Dakota, US",6376
"Stanley County, South Dakota, US",3098
"Sully County, South Dakota, US",1391
"Todd County, South Dakota, US",10177
"Tripp County, South Dakota, US",5441
"Turner County, South Dakota, US",8384
"Union County, South Dakota, US",15932
"Walworth County, South Dakota, US",5435
"Yankton County, South Dakota, US",22814
"Ziebach County, South Dakota, US",2756
"Anderson County, Tennessee, US",76978
"Bedford County, Tennessee, US",49713
"Benton County, Tennessee, US",16160
"Bledsoe County, Tennessee, US",15064
"Blount County, Tennessee, US",133088
"Bradley County, Tennessee, US",108110
"Campbell County, Tennessee, US",39842
"Cannon County, Tennessee, US",14678
"Carroll County, Tennessee, US",27767
"Carter County, Tennessee, US",56391
"Cheatham County, Tennessee, US",40667
"Chester County, Tennessee, US",17297
"Claiborne County, Tennessee, US",31959
"Clay County, Tennessee, US",7615
"Cocke County, Tennessee, US",36004
"Coffee County, Tennessee, US",56520
"Crockett County, Tennessee, US",14230
"Cumberland County, Tennessee, US",60520
"Davidson County, Tennessee, US",694144
"Decatur County, Tennessee, US",11663
"DeKalb County, Tennessee, US",20490
"Dickson County, Tennessee, US",53948
"Dyer County, Tennessee, US",37159
"Fayette County, Tennessee, US",41133
"Fentress County, Tennessee, US",18523
"Franklin County, Tennessee, US",42208
"Gibson County, Tennessee, US",49133
"Giles County, Tennessee, US",29464
"Grainger County, Tennessee, US",23320
"Greene County, Tennessee, US",69069
"Grundy County, Tennessee, US",13427
"Hamblen County, Tennessee, US",64934
"Hamilton County, Tennessee, US",367804
"Hancock County, Tennessee, US",6620
"Hardeman County, Tennessee, US",25050
"Hardin County, Tennessee, US",25652
"Hawkins County, Tennessee, US",56786
"Haywood County, Tennessee, US",17304
"Henderson County, Tennessee, US",28117
"Henry County, Tennessee, US",32345
"Hickman County, Tennessee, US",25178
"Houston County, Tennessee, US",8201
"Humphreys County, Tennessee, US",18582
"Jackson County, Tennessee, US",11786
"Jefferson County, Tennessee, US",54495
"Johnson County, Tennessee, US",17788
"Knox County, Tennessee, US",470313
"Lake County, Tennessee, US",7016
"Lauderdale County, Tennessee, US",25633
"Lawrence County, Tennessee, US",44142
"Lewis County, Tennessee, US",12268
"Lincoln County, Tennessee, US",34366
"Loudon County, Tennessee, US",54068
"McMinn County, Tennessee, US",53794
"McNairy County, Tennessee, US",25694
"Macon County, Tennessee, US",24602
"Madison County, Tennessee, US",97984
"Marion County, Tennessee, US",28907
"Marshall County, Tennessee, US",34375
"Maury County, Tennessee, US",96387
"Meigs County, Tennessee, US",12422
"Monroe County, Tennessee, US",46545
"Montgomery County, Tennessee, US",208993
"Moore County, Tennessee, US",6488
"Morgan County, Tennessee, US",21403
"Obion County, Tennessee, US",30069
"Overton County, Tennessee, US",22241
"Perry County, Tennessee, US",8076
"Pickett County, Tennessee, US",5048
"Polk County, Tennessee, US",16832
"Putnam County, Tennessee, US",80245
"Rhea County, Tennessee, US",33167
"Roane County, Tennessee, US",53382
"Robertson County, Tennessee, US",71813
"Rutherford County, Tennessee, US",332285
"Scott County, Tennessee, US",22068
"Sequatchie County, Tennessee, US",15026
"Sevier County, Tennessee, US",98250
"Shelby County, Tennessee, US",937166
"Smith County, Tennessee, US",20157
"Stewart County, Tennessee, US",13715
"Sullivan County, Tennessee, US",158348
"Sumner County, Tennessee, US",191283
"Tipton County, Tennessee, US",61599
"Trousdale County, Tennessee, US",11284
"Unicoi County, Tennessee, US",17883
"Union County, Tennessee, US",19972
"Van Buren County, Tennessee, US",5872
"Warren County, Tennessee, US",41277
"Washington County, Tennessee, US",129375
"Wayne County, Tennessee, US",16673
"Weakley County, Tennessee, US",33328
"White County, Tennessee, US",27345
"Williamson County, Tennessee, US",238412
"Wilson County, Tennessee, US",144657
"Anderson County, Texas, US",57735
"Andrews County, Texas, US",18705
"Angelina County, Texas, US",86715
"Aransas County, Texas, US",23510
"Archer County, Texas, US",8553
"Armstrong County, Texas, US",1887
"Atascosa County, Texas, US",51153
"Austin County, Texas, US",30032
"Bailey County, Texas, US",7000
"Bandera County, Texas, US",23112
"Bastrop County, Texas, US",88723
"Baylor County, Texas, US",3509
"Bee County, Texas, US",32565
"Bell County, Texas, US",362924
"Bexar County, Texas, US",2003554
"Blanco County, Texas, US",11931
"Borden County, Texas, US",654
"Bosque County, Texas, US",18685
"Bowie County, Texas, US",93245
"Brazoria County, Texas, US",374264
"Brazos County, Texas, US",229211
"Brewster County, Texas, US",9203
"Briscoe County, Texas, US",1546
"Brooks County, Texas, US",7093
"Brown County, Texas, US",37864
"Burleson County, Texas, US",18443
"Burnet County, Texas, US",48155
"Caldwell County, Texas, US",43664
"Calhoun County, Texas, US",21290
"Callahan County, Texas, US",13943
"Cameron County, Texas, US",423163
"Camp County, Texas, US",13094
"Carson County, Texas, US",5926
"Cass County, Texas, US",30026
"Castro County, Texas, US",7530
"Chambers County, Texas, US",43837
"Cherokee County, Texas, US",52646
"Childress County, Texas, US",7306
"Clay County, Texas, US",10471
"Cochran County, Texas, US",2853
"Coke County, Texas, US",3387
"Coleman County, Texas, US",8175
"Collin County, Texas, US",1034730
"Collingsworth County, Texas, US",2920
"Colorado County, Texas, US",21493
"Comal County, Texas, US",156209
"Comanche County, Texas, US",13635
"Concho County, Texas, US",2726
"Cooke County, Texas, US",41257
"Coryell County, Texas, US",75951
"Cottle County, Texas, US",1398
"Crane County, Texas, US",4797
"Crockett County, Texas, US",3464
"Crosby County, Texas, US",5737
"Culberson County, Texas, US",2171
"Dallam County, Texas, US",7287
"Dallas County, Texas, US",2635516
"Dawson County, Texas, US",12728
"Deaf Smith County, Texas, US",18546
"Delta County, Texas, US",5331
"Denton County, Texas, US",887207
"DeWitt County, Texas, US",20160
"Dickens County, Texas, US",2211
"Dimmit County, Texas, US",10124
"Donley County, Texas, US",3278
"Duval County, Texas, US",11157
"Eastland County, Texas, US",18360
"Ector County, Texas, US",166223
"Edwards County, Texas, US",1932
"Ellis County, Texas, US",184826
"El Paso County, Texas, US",839238
"Erath County, Texas, US",42698
"Falls County, Texas, US",17297
"Fannin County, Texas, US",35514
"Fayette County, Texas, US",25346
"Fisher County, Texas, US",3830
"Floyd County, Texas, US",5712
"Foard County, Texas, US",1155
"Fort Bend County, Texas, US",811688
"Franklin County, Texas, US",10725
"Freestone County, Texas, US",19717
"Frio County, Texas, US",20306
"Gaines County, Texas, US",21492
"Galveston County, Texas, US",342139
"Garza County, Texas, US",6229
"Gillespie County, Texas, US",26988
"Glasscock County, Texas, US",1409
"Goliad County, Texas, US",7658
"Gonzales County, Texas, US",20837
"Gray County, Texas, US",21886
"Grayson County, Texas, US",136212
"Gregg County, Texas, US",123945
"Grimes County, Texas, US",28880
"Guadalupe County, Texas, US",166847
"Hale County, Texas, US",33406
"Hall County, Texas, US",2964
"Hamilton County, Texas, US",8461
"Hansford County, Texas, US",5399
"Hardeman County, Texas, US",3933
"Hardin County, Texas, US",57602
"Harris County, Texas, US",4713325
"Harrison County, Texas, US",66553
"Hartley County, Texas, US",5576
"Haskell County, Texas, US",5658
"Hays County, Texas, US",230191
"Hemphill County, Texas, US",3819
"Henderson County, Texas, US",82737
"Hidalgo County, Texas, US",868707
"Hill County, Texas, US",36649
"Hockley County, Texas, US",23021
"Hood County, Texas, US",61643
"Hopkins County, Texas, US",37084
"Houston County, Texas, US",22968
"Howard County, Texas, US",36664
"Hudspeth County, Texas, US",4886
"Hunt County, Texas, US",98594
"Hutchinson County, Texas, US",20938
"Irion County, Texas, US",1536
"Jack County, Texas, US",8935
"Jackson County, Texas, US",14760
"Jasper County, Texas, US",35529
"Jeff Davis County, Texas, US",2274
"Jefferson County, Texas, US",251565
"Jim Hogg County, Texas, US",5200
"Jim Wells County, Texas, US",40482
"Johnson County, Texas, US",175817
"Jones County, Texas, US",20083
"Karnes County, Texas, US",15601
"Kaufman County, Texas, US",136154
"Kendall County, Texas, US",47431
"Kenedy County, Texas, US",404
"Kent County, Texas, US",762
"Kerr County, Texas, US",52600
"Kimble County, Texas, US",4337
"King County, Texas, US",272
"Kinney County, Texas, US",3667
"Kleberg County, Texas, US",30680
"Knox County, Texas, US",3664
"Lamar County, Texas, US",49859
"Lamb County, Texas, US",12893
"Lampasas County, Texas, US",21428
"La Salle County, Texas, US",7520
"Lavaca County, Texas, US",20154
"Lee County, Texas, US",17239
"Leon County, Texas, US",17404
"Liberty County, Texas, US",88219
"Limestone County, Texas, US",23437
"Lipscomb County, Texas, US",3233
"Live Oak County, Texas, US",12207
"Llano County, Texas, US",21795
"Loving County, Texas, US",169
"Lubbock County, Texas, US",310569
"Lynn County, Texas, US",5951
"McCulloch County, Texas, US",7984
"McLennan County, Texas, US",256623
"McMullen County, Texas, US",743
"Madison County, Texas, US",14284
"Marion County, Texas, US",9854
"Martin County, Texas, US",5771
"Mason County, Texas, US",4274
"Matagorda County, Texas, US",36643
"Maverick County, Texas, US",58722
"Medina County, Texas, US",51584
"Menard County, Texas, US",2138
"Midland County, Texas, US",176832
"Milam County, Texas, US",24823
"Mills County, Texas, US",4873
"Mitchell County, Texas, US",8545
"Montague County, Texas, US",19818
"Montgomery County, Texas, US",607391
"Moore County, Texas, US",20940
"Morris County, Texas, US",12388
"Motley County, Texas, US",1200
"Nacogdoches County, Texas, US",65204
"Navarro County, Texas, US",50113
"Newton County, Texas, US",13595
"Nolan County, Texas, US",14714
"Nueces County, Texas, US",362294
"Ochiltree County, Texas, US",9836
"Oldham County, Texas, US",2112
"Orange County, Texas, US",83396
"Palo Pinto County, Texas, US",29189
"Panola County, Texas, US",23194
"Parker County, Texas, US",142878
"Parmer County, Texas, US",9605
"Pecos County, Texas, US",15823
"Polk County, Texas, US",51353
"Potter County, Texas, US",117415
"Presidio County, Texas, US",6704
"Rains County, Texas, US",12514
"Randall County, Texas, US",137713
"Reagan County, Texas, US",3849
"Real County, Texas, US",3452
"Red River County, Texas, US",12023
"Reeves County, Texas, US",15976
"Refugio County, Texas, US",6948
"Roberts County, Texas, US",854
"Robertson County, Texas, US",17074
"Rockwall County, Texas, US",104915
"Runnels County, Texas, US",10264
"Rusk County, Texas, US",54406
"Sabine County, Texas, US",10542
"San Augustine County, Texas, US",8237
"San Jacinto County, Texas, US",28859
"San Patricio County, Texas, US",66730
"San Saba County, Texas, US",6055
"Schleicher County, Texas, US",2793
"Scurry County, Texas, US",16703
"Shackelford County, Texas, US",3265
"Shelby County, Texas, US",25274
"Sherman County, Texas, US",3022
"Smith County, Texas, US",232751
