Geographic Area,2019
"Autauga County, Alabama, US",55869
"Baldwin County, Alabama, US",223234
"Barbour County, Alabama, US",24686
"Bibb County, Alabama, US",22394
"Blount County, Alabama, US",57826
"Bullock County, Alabama, US",10101
"Butler County, Alabama, US",19448
"Calhoun County, Alabama, US",113605
"Chambers County, Alabama, US",33254
"Cherokee County, Alabama, US",26196
"Chilton County, Alabama, US",44428
"Choctaw County, Alabama, US",12589
"Clarke County, Alabama, US",23622
"Clay County, Alabama, US",13235
"Cleburne County, Alabama, US",14910
"Coffee County, Alabama, US",52342
"Colbert County, Alabama, US",55241
"Conecuh County, Alabama, US",12067
"Coosa County, Alabama, US",10663
"Covington County, Alabama, US",37049
"Crenshaw County, Alabama, US",13772
"Cullman County, Alabama, US",83768
"Dale County, Alabama, US",49172
"Dallas County, Alabama, US",37196
"DeKalb County, Alabama, US",71513
"Elmore County, Alabama, US",81209
"Escambia County, Alabama, US",36633
"Etowah County, Alabama, US",102268
"Fayette County, Alabama, US",16302
"Franklin County, Alabama, US",31362
"Geneva County, Alabama, US",26271
"Greene County, Alabama, US",8111
"Hale County, Alabama, US",14651
"Henry County, Alabama, US",17205
"Houston County, Alabama, US",105882
"Jackson County, Alabama, US",51626
"Jefferson County, Alabama, US",658573
"Lamar County, Alabama, US",13805
"Lauderdale County, Alabama, US",92729
"Lawrence County, Alabama, US",32924
"Lee County, Alabama, US",164542
"Limestone County, Alabama, US",98915
"Lowndes County, Alabama, US",9726
"Macon County, Alabama, US",18068
"Madison County, Alabama, US",372909
"Marengo County, Alabama, US",18863
"Marion County, Alabama, US",29709
"Marshall County, Alabama, US",96774
"Mobile County, Alabama, US",413210
"Monroe County, Alabama, US",20733
"Montgomery County, Alabama, US",226486
"Morgan County, Alabama, US",119679
"Perry County, Alabama, US",8923
"Pickens County, Alabama, US",19930
"Pike County, Alabama, US",33114
"Randolph County, Alabama, US",22722
"Russell County, Alabama, US",57961
"St. Clair County, Alabama, US",89512
"Shelby County, Alabama, US",217702
"Sumter County, Alabama, US",12427
"Talladega County, Alabama, US",79978
"Tallapoosa County, Alabama, US",40367
"Tuscaloosa County, Alabama, US",209355
"Walker County, Alabama, US",63521
"Washington County, Alabama, US",16326
"Wilcox County, Alabama, US",10373
"Winston County, Alabama, US",23629
"Aleutians East Borough, Alaska, US",3337
"Aleutians West Census Area, Alaska, US",5634
"Anchorage Municipality, Alaska, US",288000
"Bethel Census Area, Alaska, US",18386
"Bristol Bay Borough, Alaska, US",836
"Denali Borough, Alaska, US",2097
"Dillingham Census Area, Alaska, US",4916
"Fairbanks North Star Borough, Alaska, US",96849
"Haines Borough, Alaska, US",2530
"Hoonah-Angoon Census Area, Alaska, US",2148
"Juneau City and Borough, Alaska, US",31974
"Kenai Peninsula Borough, Alaska, US",58708
"Ketchikan Gateway Borough, Alaska, US",13901
"Kodiak Island Borough, Alaska, US",12998
"Kusilvak Census Area, Alaska, US",8314
"Lake and Peninsula Borough, Alaska, US",1592
"Matanuska-Susitna Borough, Alaska, US",108317
"Nome Census Area, Alaska, US",10004
"North Slope Borough, Alaska, US",9832
"Northwest Arctic Borough, Alaska, US",7621
"Petersburg Borough, Alaska, US",3266
"Prince of Wales-Hyder Census Area, Alaska, US",6203
"Sitka City and Borough, Alaska, US",8493
"Skagway Municipality, Alaska, US",1183
"Southeast Fairbanks Census Area, Alaska, US",6893
"Valdez-Cordova Census Area, Alaska, US",9202
"Wrangell City and Borough, Alaska, US",2502
"Yakutat City and Borough, Alaska, US",579
"Yukon-Koyukuk Census Area, Alaska, US",5230
"Apache County, Arizona, US",71887
"Cochise County, Arizona, US",125922
"Coconino County, Arizona, US",143476
"Gila County, Arizona, US",54018
"Graham County, Arizona, US",38837
"Greenlee County, Arizona, US",9498
"La Paz County, Arizona, US",21108
"Maricopa County, Arizona, US",4485414
"Mohave County, Arizona, US",212181
"Navajo County, Arizona, US",110924
"Pima County, Arizona, US",1047279
"Pinal County, Arizona, US",462789
"Santa Cruz County, Arizona, US",46498
"Yavapai County, Arizona, US",235099
"Yuma County, Arizona, US",213787
"Arkansas County, Arkansas, US",17486
"Ashley County, Arkansas, US",19657
"Baxter County, Arkansas, US",41932
"Benton County, Arkansas, US",279141
"Boone County, Arkansas, US",37432
"Bradley County, Arkansas, US",10763
"Calhoun County, Arkansas, US",5189
"Carroll County, Arkansas, US",28380
"Chicot County, Arkansas, US",10118
"Clark County, Arkansas, US",22320
"Clay County, Arkansas, US",14551
"Cleburne County, Arkansas, US",24919
"Cleveland County, Arkansas, US",7956
"Columbia County, Arkansas, US",23457
"Conway County, Arkansas, US",20846
"Craighead County, Arkansas, US",110332
"Crawford County, Arkansas, US",63257
"Crittenden County, Arkansas, US",47955
"Cross County, Arkansas, US",16419
"Dallas County, Arkansas, US",7009
"Desha County, Arkansas, US",11361
"Drew County, Arkansas, US",18219
"Faulkner County, Arkansas, US",126007
"Franklin County, Arkansas, US",17715
"Fulton County, Arkansas, US",12477
"Garland County, Arkansas, US",99386
"Grant County, Arkansas, US",18265
"Greene County, Arkansas, US",45325
"Hempstead County, Arkansas, US",21532
"Hot Spring County, Arkansas, US",33771
"Howard County, Arkansas, US",13202
"Independence County, Arkansas, US",37825
"Izard County, Arkansas, US",13629
"Jackson County, Arkansas, US",16719
"Jefferson County, Arkansas, US",66824
"Johnson County, Arkansas, US",26578
"Lafayette County, Arkansas, US",6624
"Lawrence County, Arkansas, US",16406
"Lee County, Arkansas, US",8857
"Lincoln County, Arkansas, US",13024
"Little River County, Arkansas, US",12259
"Logan County, Arkansas, US",21466
"Lonoke County, Arkansas, US",73309
"Madison County, Arkansas, US",16576
"Marion County, Arkansas, US",16694
"Miller County, Arkansas, US",43257
"Mississippi County, Arkansas, US",40651
"Monroe County, Arkansas, US",6701
"Montgomery County, Arkansas, US",8986
"Nevada County, Arkansas, US",8252
"Newton County, Arkansas, US",7753
"Ouachita County, Arkansas, US",23382
"Perry County, Arkansas, US",10455
"Phillips County, Arkansas, US",17782
"Pike County, Arkansas, US",10718
"Poinsett County, Arkansas, US",23528
"Polk County, Arkansas, US",19964
"Pope County, Arkansas, US",64072
"Prairie County, Arkansas, US",8062
"Pulaski County, Arkansas, US",391911
"Randolph County, Arkansas, US",17958
"St. Francis County, Arkansas, US",24994
"Saline County, Arkansas, US",122437
"Scott County, Arkansas, US",10281
"Searcy County, Arkansas, US",7881
"Sebastian County, Arkansas, US",127827
"Sevier County, Arkansas, US",17007
"Sharp County, Arkansas, US",17442
"Stone County, Arkansas, US",12506
"Union County, Arkansas, US",38682
"Van Buren County, Arkansas, US",16545
"Washington County, Arkansas, US",239187
"White County, Arkansas, US",78753
"Woodruff County, Arkansas, US",6320
"Yell County, Arkansas, US",21341
"Alameda County, California, US",1671329
"Alpine County, California, US",1129
"Amador County, California, US",39752
"Butte County, California, US",219186
"Calaveras County, California, US",45905
"Colusa County, California, US",21547
"Contra Costa County, California, US",1153526
"Del Norte County, California, US",27812
"El Dorado County, California, US",192843
"Fresno County, California, US",999101
"Glenn County, California, US",28393
"Humboldt County, California, US",135558
"Imperial County, California, US",181215
"Inyo County, California, US",18039
"Kern County, California, US",900202
"Kings County, California, US",152940
"Lake County, California, US",64386
"Lassen County, California, US",30573
"Los Angeles County, California, US",10039107
"Madera County, California, US",157327
"Marin County, California, US",258826
"Mariposa County, California, US",17203
"Mendocino County, California, US",86749
"Merced County, California, US",277680
"Modoc County, California, US",8841
"Mono County, California, US",14444
"Monterey County, California, US",434061
"Napa County, California, US",137744
"Nevada County, California, US",99755
"Orange County, California, US",3175692
"Placer County, California, US",398329
"Plumas County, California, US",18807
"Riverside County, California, US",2470546
"Sacramento County, California, US",1552058
"San Benito County, California, US",62808
"San Bernardino County, California, US",2180085
"San Diego County, California, US",3338330
"San Francisco County, California, US",881549
"San Joaquin County, California, US",762148
"San Luis Obispo County, California, US",283111
"San Mateo County, California, US",766573
"Santa Barbara County, California, US",446499
"Santa Clara County, California, US",1927852
"Santa Cruz County, California, US",273213
"Shasta County, California, US",180080
"Sierra County, California, US",3005
"Siskiyou County, California, US",43539
"Solano County, California, US",447643
"Sonoma County, California, US",494336
"Stanislaus County, California, US",550660
"Sutter County, California, US",96971
"Tehama County, California, US",65084
"Trinity County, California, US",12285
"Tulare County, California, US",466195
"Tuolumne County, California, US",54478
"Ventura County, California, US",846006
"Yolo County, California, US",220500
"Yuba County, California, US",78668
"Adams County, Colorado, US",517421
"Alamosa County, Colorado, US",16233
"Arapahoe County, Colorado, US",656590
"Archuleta County, Colorado, US",14029
"Baca County, Colorado, US",3581
"Bent County, Colorado, US",5577
"Boulder County, Colorado, US",326196
"Broomfield County, Colorado, US",70465
"Chaffee County, Colorado, US",20356
"Cheyenne County, Colorado, US",1831
"Clear Creek County, Colorado, US",9700
"Conejos County, Colorado, US",8205
"Costilla County, Colorado, US",3887
"Crowley County, Colorado, US",6061
"Custer County, Colorado, US",5068
"Delta County, Colorado, US",31162
"Denver County, Colorado, US",727211
"Dolores County, Colorado, US",2055
"Douglas County, Colorado, US",351154
"Eagle County, Colorado, US",55127
"Elbert County, Colorado, US",26729
"El Paso County, Colorado, US",720403
"Fremont County, Colorado, US",47839
"Garfield County, Colorado, US",60061
"Gilpin County, Colorado, US",6243
"Grand County, Colorado, US",15734
"Gunnison County, Colorado, US",17462
"Hinsdale County, Colorado, US",820
"Huerfano County, Colorado, US",6897
"Jackson County, Colorado, US",1392
"Jefferson County, Colorado, US",582881
"Kiowa County, Colorado, US",1406
"Kit Carson County, Colorado, US",7097
"Lake County, Colorado, US",8127
"La Plata County, Colorado, US",56221
"Larimer County, Colorado, US",356899
"Las Animas County, Colorado, US",14506
"Lincoln County, Colorado, US",5701
"Logan County, Colorado, US",22409
"Mesa County, Colorado, US",154210
"Mineral County, Colorado, US",769
"Moffat County, Colorado, US",13283
"Montezuma County, Colorado, US",26183
"Montrose County, Colorado, US",42758
"Morgan County, Colorado, US",29068
"Otero County, Colorado, US",18278
"Ouray County, Colorado, US",4952
"Park County, Colorado, US",18845
"Phillips County, Colorado, US",4265
"Pitkin County, Colorado, US",17767
"Prowers County, Colorado, US",12172
"Pueblo County, Colorado, US",168424
"Rio Blanco County, Colorado, US",6324
"Rio Grande County, Colorado, US",11267
"Routt County, Colorado, US",25638
"Saguache County, Colorado, US",6824
"San Juan County, Colorado, US",728
"San Miguel County, Colorado, US",8179
"Sedgwick County, Colorado, US",2248
"Summit County, Colorado, US",31011
"Teller County, Colorado, US",25388
"Washington County, Colorado, US",4908
"Weld County, Colorado, US",324492
"Yuma County, Colorado, US",10019
"Fairfield County, Connecticut, US",943332
"Hartford County, Connecticut, US",891720
"Litchfield County, Connecticut, US",180333
"Middlesex County, Connecticut, US",162436
"New Haven County, Connecticut, US",854757
"New London County, Connecticut, US",265206
"Tolland County, Connecticut, US",150721
"Windham County, Connecticut, US",116782
"Kent County, Delaware, US",180786
"New Castle County, Delaware, US",558753
"Sussex County, Delaware, US",234225
"District of Columbia, District of Columbia, US",705749
"Alachua County, Florida, US",269043
"Baker County, Florida, US",29210
"Bay County, Florida, US",174705
"Bradford County, Florida, US",28201
"Brevard County, Florida, US",601942
"Broward County, Florida, US",1952778
"Calhoun County, Florida, US",14105
"Charlotte County, Florida, US",188910
"Citrus County, Florida, US",149657
"Clay County, Florida, US",219252
"Collier County, Florida, US",384902
"Columbia County, Florida, US",71686
"DeSoto County, Florida, US",38001
"Dixie County, Florida, US",16826
"Duval County, Florida, US",957755
"Escambia County, Florida, US",318316
"Flagler County, Florida, US",115081
"Franklin County, Florida, US",12125
"Gadsden County, Florida, US",45660
"Gilchrist County, Florida, US",18582
"Glades County, Florida, US",13811
"Gulf County, Florida, US",13639
"Hamilton County, Florida, US",14428
"Hardee County, Florida, US",26937
"Hendry County, Florida, US",42022
"Hernando County, Florida, US",193920
"Highlands County, Florida, US",106221
"Hillsborough County, Florida, US",1471968
"Holmes County, Florida, US",19617
"Indian River County, Florida, US",159923
"Jackson County, Florida, US",46414
"Jefferson County, Florida, US",14246
"Lafayette County, Florida, US",8422
"Lake County, Florida, US",367118
"Lee County, Florida, US",770577
"Leon County, Florida, US",293582
"Levy County, Florida, US",41503
"Liberty County, Florida, US",8354
"Madison County, Florida, US",18493
"Manatee County, Florida, US",403253
"Marion County, Florida, US",365579
"Martin County, Florida, US",161000
"Miami-Dade County, Florida, US",2716940
"Monroe County, Florida, US",74228
"Nassau County, Florida, US",88625
"Okaloosa County, Florida, US",210738
"Okeechobee County, Florida, US",42168
"Orange County, Florida, US",1393452
"Osceola County, Florida, US",375751
"Palm Beach County, Florida, US",1496770
"Pasco County, Florida, US",553947
"Pinellas County, Florida, US",974996
"Polk County, Florida, US",724777
"Putnam County, Florida, US",74521
"St. Johns County, Florida, US",264672
"St. Lucie County, Florida, US",328297
"Santa Rosa County, Florida, US",184313
"Sarasota County, Florida, US",433742
"Seminole County, Florida, US",471826
"Sumter County, Florida, US",132420
"Suwannee County, Florida, US",44417
"Taylor County, Florida, US",21569
"Union County, Florida, US",15237
"Volusia County, Florida, US",553284
"Wakulla County, Florida, US",33739
"Walton County, Florida, US",74071
"Washington County, Florida, US",25473
"Appling County, Georgia, US",18386
"Atkinson County, Georgia, US",8165
"Bacon County, Georgia, US",11164
"Baker County, Georgia, US",3038
"Baldwin County, Georgia, US",44890
"Banks County, Georgia, US",19234
"Barrow County, Georgia, US",83240
"Bartow County, Georgia, US",107738
"Ben Hill County, Georgia, US",16700
"Berrien County, Georgia, US",19397
"Bibb County, Georgia, US",153159
"Bleckley County, Georgia, US",12873
"Brantley County, Georgia, US",19109
"Brooks County, Georgia, US",15457
"Bryan County, Georgia, US",39627
"Bulloch County, Georgia, US",79608
"Burke County, Georgia, US",22383
"Butts County, Georgia, US",24936
"Calhoun County, Georgia, US",6189
"Camden County, Georgia, US",54666
"Candler County, Georgia, US",10803
"Carroll County, Georgia, US",119992
"Catoosa County, Georgia, US",67580
"Charlton County, Georgia, US",13392
"Chatham County, Georgia, US",289430
"Chattahoochee County, Georgia, US",10907
"Chattooga County, Georgia, US",24789
"Cherokee County, Georgia, US",258773
"Clarke County, Georgia, US",128331
"Clay County, Georgia, US",2834
"Clayton County, Georgia, US",292256
"Clinch County, Georgia, US",6618
"Cobb County, Georgia, US",760141
"Coffee County, Georgia, US",43273
"Colquitt County, Georgia, US",45600
"Columbia County, Georgia, US",156714
"Cook County, Georgia, US",17270
"Coweta County, Georgia, US",148509
"Crawford County, Georgia, US",12404
"Crisp County, Georgia, US",22372
"Dade County, Georgia, US",16116
"Dawson County, Georgia, US",26108
"Decatur County, Georgia, US",26404
"DeKalb County, Georgia, US",759297
"Dodge County, Georgia, US",20605
"Dooly County, Georgia, US",13390
"Dougherty County, Georgia, US",87956
"Douglas County, Georgia, US",146343
"Early County, Georgia, US",10190
"Echols County, Georgia, US",4006
"Effingham County, Georgia, US",64296
"Elbert County, Georgia, US",19194
"Emanuel County, Georgia, US",22646
"Evans County, Georgia, US",10654
"Fannin County, Georgia, US",26188
"Fayette County, Georgia, US",114421
"Floyd County, Georgia, US",98498
"Forsyth County, Georgia, US",244252
"Franklin County, Georgia, US",23349
"Fulton County, Georgia, US",1063937
"Gilmer County, Georgia, US",31369
"Glascock County, Georgia, US",2971
"Glynn County, Georgia, US",85292
"Gordon County, Georgia, US",57963
"Grady County, Georgia, US",24633
"Greene County, Georgia, US",18324
"Gwinnett County, Georgia, US",936250
"Habersham County, Georgia, US",45328
"Hall County, Georgia, US",204441
"Hancock County, Georgia, US",8457
"Haralson County, Georgia, US",29792
"Harris County, Georgia, US",35236
"Hart County, Georgia, US",26205
"Heard County, Georgia, US",11923
"Henry County, Georgia, US",234561
"Houston County, Georgia, US",157863
"Irwin County, Georgia, US",9416
"Jackson County, Georgia, US",72977
"Jasper County, Georgia, US",14219
"Jeff Davis County, Georgia, US",15115
"Jefferson County, Georgia, US",15362
"Jenkins County, Georgia, US",8676
"Johnson County, Georgia, US",9643
"Jones County, Georgia, US",28735
"Lamar County, Georgia, US",19077
"Lanier County, Georgia, US",10423
"Laurens County, Georgia, US",47546
"Lee County, Georgia, US",29992
"Liberty County, Georgia, US",61435
"Lincoln County, Georgia, US",7921
"Long County, Georgia, US",19559
"Lowndes County, Georgia, US",117406
"Lumpkin County, Georgia, US",33610
"McDuffie County, Georgia, US",21312
"McIntosh County, Georgia, US",14378
"Macon County, Georgia, US",12947
"Madison County, Georgia, US",29880
"Marion County, Georgia, US",8359
"Meriwether County, Georgia, US",21167
"Miller County, Georgia, US",5718
"Mitchell County, Georgia, US",21863
"Monroe County, Georgia, US",27578
"Montgomery County, Georgia, US",9172
"Morgan County, Georgia, US",19276
"Murray County, Georgia, US",40096
"Muscogee County, Georgia, US",195769
"Newton County, Georgia, US",111744
"Oconee County, Georgia, US",40280
"Oglethorpe County, Georgia, US",15259
"Paulding County, Georgia, US",168667
"Peach County, Georgia, US",27546
"Pickens County, Georgia, US",32591
"Pierce County, Georgia, US",19465
"Pike County, Georgia, US",18962
"Polk County, Georgia, US",42613
"Pulaski County, Georgia, US",11137
"Putnam County, Georgia, US",22119
"Quitman County, Georgia, US",2299
"Rabun County, Georgia, US",17137
"Randolph County, Georgia, US",6778
"Richmond County, Georgia, US",202518
"Rockdale County, Georgia, US",90896
"Schley County, Georgia, US",5257
"Screven County, Georgia, US",13966
"Seminole County, Georgia, US",8090
"Spalding County, Georgia, US",66703
"Stephens County, Georgia, US",25925
"Stewart County, Georgia, US",6621
"Sumter County, Georgia, US",29524
"Talbot County, Georgia, US",6195
"Taliaferro County, Georgia, US",1537
"Tattnall County, Georgia, US",25286
"Taylor County, Georgia, US",8020
"Telfair County, Georgia, US",15860
"Terrell County, Georgia, US",8531
"Thomas County, Georgia, US",44451
"Tift County, Georgia, US",40644
"Toombs County, Georgia, US",26830
"Towns County, Georgia, US",12037
"Treutlen County, Georgia, US",6901
"Troup County, Georgia, US",69922
"Turner County, Georgia, US",7985
"Twiggs County, Georgia, US",8120
"Union County, Georgia, US",24511
"Upson County, Georgia, US",26320
"Walker County, Georgia, US",69761
"Walton County, Georgia, US",94593
"Ware County, Georgia, US",35734
"Warren County, Georgia, US",5254
"Washington County, Georgia, US",20374
"Wayne County, Georgia, US",29927
"Webster County, Georgia, US",2607
"Wheeler County, Georgia, US",7855
"White County, Georgia, US",30798
"Whitfield County, Georgia, US",104628
"Wilcox County, Georgia, US",8635
"Wilkes County, Georgia, US",9777
"Wilkinson County, Georgia, US",8954
"Worth County, Georgia, US",20247
"Hawaii County, Hawaii, US",201513
"Honolulu County, Hawaii, US",974563
"Kalawao County, Hawaii, US",86
"Kauai County, Hawaii, US",72293
"Maui County, Hawaii, US",167417
"Ada County, Idaho, US",481587
"Adams County, Idaho, US",4294
"Bannock County, Idaho, US",87808
"Bear Lake County, Idaho, US",6125
"Benewah County, Idaho, US",9298
"Bingham County, Idaho, US",46811
"Blaine County, Idaho, US",23021
"Boise County, Idaho, US",7831
"Bonner County, Idaho, US",45739
"Bonneville County, Idaho, US",119062
"Boundary County, Idaho, US",12245
"Butte County, Idaho, US",2597
"Camas County, Idaho, US",1106
"Canyon County, Idaho, US",229849
"Caribou County, Idaho, US",7155
"Cassia County, Idaho, US",24030
"Clark County, Idaho, US",845
"Clearwater County, Idaho, US",8756
"Custer County, Idaho, US",4315
"Elmore County, Idaho, US",27511
"Franklin County, Idaho, US",13876
"Fremont County, Idaho, US",13099
"Gem County, Idaho, US",18112
"Gooding County, Idaho, US",15179
"Idaho County, Idaho, US",16667
"Jefferson County, Idaho, US",29871
"Jerome County, Idaho, US",24412
"Kootenai County, Idaho, US",165697
"Latah County, Idaho, US",40108
"Lemhi County, Idaho, US",8027
"Lewis County, Idaho, US",3838
"Lincoln County, Idaho, US",5366
"Madison County, Idaho, US",39907
"Minidoka County, Idaho, US",21039
"Nez Perce County, Idaho, US",40408
"Oneida County, Idaho, US",4531
"Owyhee County, Idaho, US",11823
"Payette County, Idaho, US",23951
"Power County, Idaho, US",7681
"Shoshone County, Idaho, US",12882
"Teton County, Idaho, US",12142
"Twin Falls County, Idaho, US",86878
"Valley County, Idaho, US",11392
"Washington County, Idaho, US",10194
"Adams County, Illinois, US",65435
"Alexander County, Illinois, US",5761
"Bond County, Illinois, US",16426
"Boone County, Illinois, US",53544
"Brown County, Illinois, US",6578
"Bureau County, Illinois, US",32628
"Calhoun County, Illinois, US",4739
"Carroll County, Illinois, US",14305
"Cass County, Illinois, US",12147
"Champaign County, Illinois, US",209689
"Christian County, Illinois, US",32304
"Clark County, Illinois, US",15441
"Clay County, Illinois, US",13184
"Clinton County, Illinois, US",37562
"Coles County, Illinois, US",50621
"Cook County, Illinois, US",5150233
"Crawford County, Illinois, US",18667
"Cumberland County, Illinois, US",10766
"DeKalb County, Illinois, US",104897
"De Witt County, Illinois, US",15638
"Douglas County, Illinois, US",19465
"DuPage County, Illinois, US",922921
"Edgar County, Illinois, US",17161
"Edwards County, Illinois, US",6395
"Effingham County, Illinois, US",34008
"Fayette County, Illinois, US",21336
"Ford County, Illinois, US",12961
"Franklin County, Illinois, US",38469
"Fulton County, Illinois, US",34340
"Gallatin County, Illinois, US",4828
"Greene County, Illinois, US",12969
"Grundy County, Illinois, US",51054
"Hamilton County, Illinois, US",8116
"Hancock County, Illinois, US",17708
"Hardin County, Illinois, US",3821
"Henderson County, Illinois, US",6646
"Henry County, Illinois, US",48913
"Iroquois County, Illinois, US",27114
"Jackson County, Illinois, US",56750
"Jasper County, Illinois, US",9610
"Jefferson County, Illinois, US",37684
"Jersey County, Illinois, US",21773
"Jo Daviess County, Illinois, US",21235
"Johnson County, Illinois, US",12417
"Kane County, Illinois, US",532403
"Kankakee County, Illinois, US",109862
"Kendall County, Illinois, US",128990
"Knox County, Illinois, US",49699
"Lake County, Illinois, US",696535
"LaSalle County, Illinois, US",108669
"Lawrence County, Illinois, US",15678
"Lee County, Illinois, US",34096
"Livingston County, Illinois, US",35648
"Logan County, Illinois, US",28618
"McDonough County, Illinois, US",29682
"McHenry County, Illinois, US",307774
"McLean County, Illinois, US",171517
"Macon County, Illinois, US",104009
"Macoupin County, Illinois, US",44926
"Madison County, Illinois, US",262966
"Marion County, Illinois, US",37205
"Marshall County, Illinois, US",11438
"Mason County, Illinois, US",13359
"Massac County, Illinois, US",13772
"Menard County, Illinois, US",12196
"Mercer County, Illinois, US",15437
"Monroe County, Illinois, US",34637
"Montgomery County, Illinois, US",28414
"Morgan County, Illinois, US",33658
"Moultrie County, Illinois, US",14501
"Ogle County, Illinois, US",50643
"Peoria County, Illinois, US",179179
"Perry County, Illinois, US",20916
"Piatt County, Illinois, US",16344
"Pike County, Illinois, US",15561
"Pope County, Illinois, US",4177
"Pulaski County, Illinois, US",5335
"Putnam County, Illinois, US",5739
"Randolph County, Illinois, US",31782
"Richland County, Illinois, US",15513
"Rock Island County, Illinois, US",141879
"St. Clair County, Illinois, US",259686
"Saline County, Illinois, US",23491
"Sangamon County, Illinois, US",194672
"Schuyler County, Illinois, US",6768
"Scott County, Illinois, US",4951
"Shelby County, Illinois, US",21634
"Stark County, Illinois, US",5342
"Stephenson County, Illinois, US",44498
"Tazewell County, Illinois, US",131803
"Union County, Illinois, US",16653
"Vermilion County, Illinois, US",75758
"Wabash County, Illinois, US",11520
